{
    "version": 2,
    "shader": "gyroid.glsl",
    "out": "output/gyroid-glsl",
    "grid": {
        "aabb_min": [-64, -64, -64],
        "aabb_size": [128, 128, 128],
        "brick_size": 64
    },
    "genmesh": {
        "write_vdb": true
    },
    "presets": [
        {
            "name": "draft",
            "grid": { "voxel_size": 2.0 }
        },
        {
            "name": "fine",
            "grid": { "voxel_size": 0.5 },
            "mesh": { "adaptivity": 0.2 }
        }
    ]
}
